<?xml version="1.0"?>
<!DOCTYPE Preferences SYSTEM "http://poepsn05.po.conoco.com/Conoco/xml/preferences.dtd">
<Preferences>
	<ServerName>poepsn05.po.conoco.com</ServerName>
	<ScriptName>runrmi</ScriptName>
	<ServletName>http://poepsn05.po.conoco.com/servlets/com.conoco.cfe.servlet.MessagePasser</ServletName>
	<LoginServletName>http://poepsn05.po.conoco.com/servlets/com.conoco.cfe.servlet.LoginServlet</LoginServletName>
	<XMLDocPath>/Conoco/xml/</XMLDocPath>
	<BackEndLibPath>/usr/app/vendors/sps/lib/sparc-sun-solaris/libCFE.so</BackEndLibPath>
	<HelpMode value="mouse"/>
	<WithConsole value="no"/>
	<DefaultLabelFont name="SansSerif" size="14" />
	<DefaultFieldFont name="SansSerif" style="bold" size="14" />
	<DefaultArrayFont name="SansSerif" size="14" />
</Preferences>
