<?xml version="1.0"?>
<!DOCTYPE Preferences SYSTEM "file:///home/mengewm/workspace/opencfe/etc/preferences.dtd">
<Preferences>
	<XMLDocPath>file:///home/mengewm/workspace/opencfe/xml/</XMLDocPath>
	<BackEndLibPath>/home/mengewm/workspace/cpseis/lib/linux32/libcps.so</BackEndLibPath>
	<HelpMode value="mouse"/>
	<WithConsole value="yes"/>
	<DefaultLabelFont name="SansSerif" size="14" />
	<DefaultFieldFont name="SansSerif" style="bold" size="14" />
	<DefaultArrayFont name="SansSerif" size="14" />
</Preferences>
